"QuizID"	"AppID"	"AppTitle"	"TaskID"	"TaskText"	"RecordID"	"Record"	"Type"	"Note"
"DSAIDE_fitflu"	"fitflu"	"Fitting Influenza data"	8	"You might have noticed that we fixed the starting values for the model. The chosen values seem rasonable for the number susceptible and dead, but it's probably not the best idea to set the initial number of infected persons at 1. In reality, there were probably already more infected patients at the time the recording of these death data started. I could have written the model so you could fit the initial infected. I didn't since it would overcomplicate the example and likely leading to more overfitting. In general, you have different options for setting any initial value or parameter of a model. You can fix it to some value based on outside scientific knowledge. You can fit it and thus let the data tell you what the value is. Finally, you can manually choose different values and see how well results agree with data (or general knowledge of the system). The important part is the be very clear in your description what you do/did and why.

Let's briefly explore the manual adjustment of the number infected. Set values back to those of task 1. Do a quick run with a single iteration to make sure you get the SSR from task 1. Look at the plot with y-axis on a logarithmic scale. You'll again see that the initial values for deaths between model and data don't match well. Now set the initial number of infected to 1000, re-run a single iteration. You'll notice in the plot that the model predicted deaths moves closer to the data in the first few weeks. Maybe surprisingly, the SSR does not shrink. Can you figure out why? Hint: It has to do with what you learned in the last task. Take another look at the SSR equation and think about the impact of the later (higher value) data points compared to the earlier ones for the total SSR.

Now run solver 3 for 500 iterations with 1 initial infected. Depending on the speed of your computer, you might need to be patient. You should get an SSR of 1.1E10. (What does that mean for all the 'best fits' we found above with fewer interations?) Then run again for the same number of iterations, now with 1000 initial infected. Take a look at the SSR. Based on that value, did this manual adjustment of the initial number of infected improve the model fit or not?

You can also explore if/how things change if you do this with data fitted on a log scale"	"T8R1"	"The fit with 1000 initial infected is better (TRUE/FALSE)"	"Logical"	"Report TRUE or FALSE"
"DSAIDE_fitflu"	"fitflu"	"Fitting Influenza data"	9	"For the previous model fit, and most others we have looked at, take a more careful look at the predicted/best-fit fraction of infected that are dying. If you are not familiar with the 1918 flu, look up the estimated mortality and compare the actual estimates to what our model produces. What do you conclude? 

A plus of the kind of models we use here is that most parameter values have direct biological meaning. That means we can - and need to - compare the best-fit values with reality. In some cases, such as here, those best-fit values are unreasonable. A similar problem can occur if you choose lower and upper bounds for your parameters based on known biology, and the best fit occurs at the bound. Either case indicates that 'something isn't quite right'. If you ruled out overfitting, which can produce such results, it means is that your model doesn't properly capture the underlying processes for realistic parameter values, and thus needs to be modified further. This is good, because if you built your initial model based on what you thought was going on in the system, you have now learned that there is something missing, i.e. you've gained a useful insight into your system. I'm a big proponent of reporting such 'failures' in the literature, it is useful information. Unfortunately, quite often such 'dead ends' are not reported.

You might have noticed by going through these tasks that fitting models can be tricky. It is, especially if you try to fit the kinds of simulation models we are covering here. It's a lot of trial and error and practice. If you want to practice some more, keep exploring this app. You might find strange behavior in this app that you don't expect. Try to get to the bottom of what might be going on. This is an open-ended exploration, try different things and try to understand as much as possible of what you observe.

Going deeper will require some more formal training on this topic, see e.g. the materials listed in the Further Resources section."	"T9R1"	"Nothing"	"None"	""
