"QuizID"	"AppID"	"AppTitle"	"TaskID"	"TaskText"	"RecordID"	"Record"	"Type"	"Note"
"DSAIDE_fitflu"	"fitflu"	"Fitting Influenza data"	1	"The population of New York City in 1918 was roughly around 5*10^6^ individuals. Use that number as your initial starting value for the susceptibles. Set infected individuals to 1, no initial dead. The model parameters, _b_, _g_, and _f_, are being fit. Even though they are being fit/estimated, we need to provide starting values for the fitting routine. Set the starting value for the infection rate to _b=1e-6_, set the initial recovery rate such that it corresponds to an infectious period of one week, and start with the assumption that one percent of infected individuals died.

For each fitted parameter, choose lower and upper bounds that are 100 times lower/higher than the starting value for each parameter. In general, the lower/upper bound has to be lower/higher or equal to the starting value, otherwise you will get an error message when you try to run the model. For now, we ignore the option to generate simulated data. Therefore set usesimdata to 0 and the parameter values for simulated data can be arbitrary, they will be ignored. The noise parameter will also be ignored. We'll fit the data 'as is' (not the log-transformed data), so set logfit to 0. Start with a maximum of 1 fitting step/iteration and solver type 1. Random number seed at 100. We need to set the seed for reproducibility since we'll create some random numbers below and some of the fitting routines involve random numbers. Run the simulation. Since you only do a single iteration, nothing is optimized. We are just doing this so you can see the time-series produced with these starting conditions. The 'best fit' parameter values are the same you started with. To that end, with that choice, your SSR should be 7.3*10^12^.

To see the (mis)match between data and model, you will probably want to look at plots with the y-axis both on the linear and log scale."	"T1R1"	"Nothing"	"None"	""
"DSAIDE_fitflu"	"fitflu"	"Fitting Influenza data"	2	"Set the maximum number of iterations to 20, and re-run the simulation. All of the other settings should be the same from task 1. Look at the results. The plot shows the final fit. The model-predicted curve for deaths will be closer to the data. Also, the SSR value should have gone down, to 1.2E12, indicating a better fit. Also printed below the figure are the values of the fitted parameters at the end of the fitting process. Set the iterations to 200, and re-run the simulation. You should see further improvement in SSR, to around 1.6E11. That indicates the previous fit was not the best fit. (The best fit is the one with the lowest possible SSR)."	"T2R1"	"Estimate for parameter f (fraction dying) after 20 iterations, solver 1"	"Numeric"	"Round to two significant digits, report as non-scientic notation (as X.YZ)"
"DSAIDE_fitflu"	"fitflu"	"Fitting Influenza data"	2	"Set the maximum number of iterations to 20, and re-run the simulation. All of the other settings should be the same from task 1. Look at the results. The plot shows the final fit. The model-predicted curve for deaths will be closer to the data. Also, the SSR value should have gone down, to 1.2E12, indicating a better fit. Also printed below the figure are the values of the fitted parameters at the end of the fitting process. Set the iterations to 200, and re-run the simulation. You should see further improvement in SSR, to around 1.6E11. That indicates the previous fit was not the best fit. (The best fit is the one with the lowest possible SSR)."	"T2R2"	"Estimate for parameter f (fraction dying) after 200 iterations, solver 1"	"Numeric"	"Round to two significant digits, report as non-scientic notation (as X.YZ)"
"DSAIDE_fitflu"	"fitflu"	"Fitting Influenza data"	3	"Repeat the fits for 1, 20 and 200 iterations using solver/optimizer type 2 (solvertype = 2), then do it again for type/number 3. Keep all other settings as before. You will notice that the different solvers do not give the same results. Depending on the speed of your computer, you can try to increase the number of iterations and see what best fit (smallest SSR) you can achieve. 

Theoretically, there is a single best fit that all solvers/optimizers should find if you run them for enough iterations. Unfortunately, that's often not true in practice. For some fitting problems, e.g. fitting a linear model, the type of numerical optimizer routine that is used doesn't matter, as long as you run it for enough iterations you'll find the best fit. Unfortunately, for fitting ODE type models, that is rarely the case. Thus it is important to try multiple optimizers (and multiple starting values). By trying different numerical routines and different starting values, and running each for many iterations, you might be able to find the best overall fit (but there is unfortunately never a guarantee). 

Generally, with increasing iterations, the fits get better. A fitting step or iteration is essentially an attempt by the underlying code to find the best possible model. Increasing the tries usually improves the fit. In practice, one should not specify a fixed number of iterations. We do it here, so things run reasonably fast. Instead, one should ask the solver to run as long as it takes until it can't find a way to improve the fit (can't further reduce the SSR). The technical expression for this is that the solver has converged to the solution. This can be done with the solver used here (`nloptr` R package), but it would take too long, so we implement a hard stop after the specified number of iterations."	"T3R1"	"Estimate for parameter f (fraction dying) after 200 iterations, solver 2"	"Numeric"	"Round to two significant digits, report as non-scientic notation (as X.YZ)"
"DSAIDE_fitflu"	"fitflu"	"Fitting Influenza data"	3	"Repeat the fits for 1, 20 and 200 iterations using solver/optimizer type 2 (solvertype = 2), then do it again for type/number 3. Keep all other settings as before. You will notice that the different solvers do not give the same results. Depending on the speed of your computer, you can try to increase the number of iterations and see what best fit (smallest SSR) you can achieve. 

Theoretically, there is a single best fit that all solvers/optimizers should find if you run them for enough iterations. Unfortunately, that's often not true in practice. For some fitting problems, e.g. fitting a linear model, the type of numerical optimizer routine that is used doesn't matter, as long as you run it for enough iterations you'll find the best fit. Unfortunately, for fitting ODE type models, that is rarely the case. Thus it is important to try multiple optimizers (and multiple starting values). By trying different numerical routines and different starting values, and running each for many iterations, you might be able to find the best overall fit (but there is unfortunately never a guarantee). 

Generally, with increasing iterations, the fits get better. A fitting step or iteration is essentially an attempt by the underlying code to find the best possible model. Increasing the tries usually improves the fit. In practice, one should not specify a fixed number of iterations. We do it here, so things run reasonably fast. Instead, one should ask the solver to run as long as it takes until it can't find a way to improve the fit (can't further reduce the SSR). The technical expression for this is that the solver has converged to the solution. This can be done with the solver used here (`nloptr` R package), but it would take too long, so we implement a hard stop after the specified number of iterations."	"T3R2"	"Estimate for parameter f (fraction dying) after 200 iterations, solver 3"	"Numeric"	"Round to two significant digits, report as non-scientic notation (as X.YZ)"
"DSAIDE_fitflu"	"fitflu"	"Fitting Influenza data"	4	"As mentioned, when fitting difficult models like ODE models to data, it can be hard to find the best fit. Trying different solvers is useful. Another important consideration are the starting values for the fitted parameters. Let's explore how starting values matter. For a single iteration (no fitting), with the starting conditions we have chosen so far (S=5E6, I=1, D=0, b=1E-6, g=1, f=0.01), we get an SSR=7.3E12. In the previous task, you found that using solver 3 for 200 iterations, you get SSR=2.3E10 (also note the values for the best fit parameters).

Now change the starting values to half a week of infectiousness duration and a 5 percent mortality fraction. Keep the bounds unchanged. Re-run the fit with solver 3 for both 1 and 200 iterations. You should find before/after SSR values of 4.7E12 and 1.8E11. This means the starting values were somewhat better (7.3E12 versus 4.7E12), but it didn't help for the fitting, at least not for 200 steps (2.3E10 versus 1.8E11). 

By trying different starting values, solvers, and number of iterations you can get an idea of the influence starting conditions can have on fitting performance and results. In general, picking good starting values is important. One can get them by trying an initial visual fit or by doing several short fits, and use the best fit values at the end as starting values for a new fit.

Especially if you want to fit multiple parameters, optimizers can 'get stuck'. If they get stuck, even running them for a long time might not find the best fit. One way an optimizer can get stuck is when a solver finds a local optimum. The local optimum is a good fit, and now as the solver varies parameters, each new fit is worse, so the solver 'thinks' it found the best fit, even though there are better ones further away in parameter space. Many solvers - even so-called 'global' solvers - can get stuck. Unfortunately, we never know if the solution is real or if the solver is stuck in a local optimum. One way to figure this out is to try different solvers and different starting conditions, and let each one run for a long time. If all return the same answer, no matter what type of solver you use and where you start, it's quite likely (though not guaranteed) that we found the overall best fit (lowest SSR).
 
The problem of 'getting stuck' is something that frequently happens when trying to fit ODE models, which is in contrast to fitting more standard models (e.g., a linear regression model), where it is not a problem. The technical reason for this is that a simple regression optimization is _convex_ while fitting an ODE model is usually not. That's why you don't have to worry if you found the right solution if you use the `lm` or `glm` functions for fitting in `R`. When fitting more complicated models such as ODE or similar models, you do have to carefully check that the 'best fit' is not the result of a local optimum."	"T4R1"	"Estimate for parameter f (fraction dying) after 200 iterations, solver 3 for initial starting values"	"Numeric"	"Round to two significant digits, report as non-scientic notation (as X.YZ)"
"DSAIDE_fitflu"	"fitflu"	"Fitting Influenza data"	4	"As mentioned, when fitting difficult models like ODE models to data, it can be hard to find the best fit. Trying different solvers is useful. Another important consideration are the starting values for the fitted parameters. Let's explore how starting values matter. For a single iteration (no fitting), with the starting conditions we have chosen so far (S=5E6, I=1, D=0, b=1E-6, g=1, f=0.01), we get an SSR=7.3E12. In the previous task, you found that using solver 3 for 200 iterations, you get SSR=2.3E10 (also note the values for the best fit parameters).

Now change the starting values to half a week of infectiousness duration and a 5 percent mortality fraction. Keep the bounds unchanged. Re-run the fit with solver 3 for both 1 and 200 iterations. You should find before/after SSR values of 4.7E12 and 1.8E11. This means the starting values were somewhat better (7.3E12 versus 4.7E12), but it didn't help for the fitting, at least not for 200 steps (2.3E10 versus 1.8E11). 

By trying different starting values, solvers, and number of iterations you can get an idea of the influence starting conditions can have on fitting performance and results. In general, picking good starting values is important. One can get them by trying an initial visual fit or by doing several short fits, and use the best fit values at the end as starting values for a new fit.

Especially if you want to fit multiple parameters, optimizers can 'get stuck'. If they get stuck, even running them for a long time might not find the best fit. One way an optimizer can get stuck is when a solver finds a local optimum. The local optimum is a good fit, and now as the solver varies parameters, each new fit is worse, so the solver 'thinks' it found the best fit, even though there are better ones further away in parameter space. Many solvers - even so-called 'global' solvers - can get stuck. Unfortunately, we never know if the solution is real or if the solver is stuck in a local optimum. One way to figure this out is to try different solvers and different starting conditions, and let each one run for a long time. If all return the same answer, no matter what type of solver you use and where you start, it's quite likely (though not guaranteed) that we found the overall best fit (lowest SSR).
 
The problem of 'getting stuck' is something that frequently happens when trying to fit ODE models, which is in contrast to fitting more standard models (e.g., a linear regression model), where it is not a problem. The technical reason for this is that a simple regression optimization is _convex_ while fitting an ODE model is usually not. That's why you don't have to worry if you found the right solution if you use the `lm` or `glm` functions for fitting in `R`. When fitting more complicated models such as ODE or similar models, you do have to carefully check that the 'best fit' is not the result of a local optimum."	"T4R2"	"Estimate for parameter f (fraction dying) after 200 iterations, solver 3 for second set of starting values"	"Numeric"	"Round to two significant digits, report as non-scientic notation (as X.YZ)"
"DSAIDE_fitflu"	"fitflu"	"Fitting Influenza data"	5	"When fitting models to data, there needs to be a balance between the amount of available data and the number of model parameters you want to estimate. If you 'ask too much' from the data, it leads to the problem of overfitting. Overfitting can be thought of as trying to estimate more parameters than can be robustly estimated for a given dataset. One way to check if overfitting might be a problem is to run the model with known values of the parameters you want to fit, then use the model result to generate artificial data, and use that generated data for fitting. If everything works, we expect that - ideally independent of the starting values for our solver - we end up with estimated best-fit parameter values that agree with the ones we used to simulate the artificial data. If we don't, it's an indication of something gone wrong (e.g. bad starting conditions) or that the data are just not sufficient to reliably estimate all the parameters we want to determine. 

We'll try this now with the app. Set everything as in task 1. Set the parameter values _bsim_, _gsim_, and _fsim_ to the same values as the values used for starting the fitting routine (_S_ = 5E6, _I_ = 1, _D_ = 0, _b_ = _bsim_ = 1E-6, _g_ = _gsim_ = 1, _f_ = _fsim_ = 0.01). Set _usesimdata_ to 1, keep _noise_ at 0. Run for 1 fitting step, solver 3. You should now see that the data has changed. Instead of the real data, we now use simulated data. Since the parameter values for the simulated data and the starting values for the fitting routine are the same, the time-series is on top of the data, and the SSR is (up to rounding errors) 0. 

Now let's see if the fitting routine can recover parameters from a simulation if we start with different initial/starting values. Choose as values for simulated data parameters _bsim_ = 5E-7, _gsim_ = 0.5 and _fsim_ = 0.02. Keep everything else unchanged. Importantly, the starting values for the parameters _b_ and _g_ are now different than the values used for the simulation. Fit to the simulated data, run for 1 iteration. You'll see the (simulated) data change again. The SSR should be 1.3E10. If you now run the fitting for many iterations/steps, what do you expect the final fit values for the parameters and the SSR to be? Test your expectation by running solver 2 for 200 steps. You can also try different iteration steps and different solvers.

If things work ok, we should expect that with enough iterations, the estimated values for the parameters are the same as those used to generate the artificial data. That seems to be the case here. That indicates that you can potentially estimate these 3 model parameters with the available data, at least if there is no noise. This is the most basic test. If you can't get the best fit values to be the same as the ones you used to make the data, it means you are trying to fit more parameters than your data can support, i.e., you are overfitting. At that point, you will have to either get more data or reduce your fitted parameters. Reducing fitted parameters can be done by either fixing some parameters based on biological a priori knowledge or by reducing the number of parameters through model simplification."	"T5R1"	"Estimate for parameter f (fraction dying) after 200 iterations, solver 2"	"Numeric"	"Round to two significant digits, report as non-scientic notation (as X.YZ)"
"DSAIDE_fitflu"	"fitflu"	"Fitting Influenza data"	6	"To make things a bit more realistic and harder, one can also add noise on top of the simulated data. Try that by playing with the 'noise added' parameter and see how well you can recover the parameter values for the simulation. Keep values as before, with a mismatch between parameter values for the simulated data, and starting values for the fitting routine (_S_ = 5E6, _I_ = 1, _D_ = 0, _b_ =  1E-6, _g_ = 1, _f_ = 0.01, _bsim_ = 5E-7, _gsim_ = 0.5, _fsim_ = 0.02). Now we'll also add noise of strength 0.1 (this is uniformly distributed random numbers scaled by the parameter values. See the underlying code for details, which are not that important here.) Run solver 2 for 200 steps. Now the SSR is not close to zero (it should be approximately 1E8) and the estimated parameters are not exactly those that are used to run the simulation, since we perturbed the simulated data with some noise. But they should be close. If you are able to get values back that are close to the ones you simulated the data, it's a good sign you might be able to estimate all your parameters using the real data.

Play around with different values for the parameters used to generate artificial data, and different values for the starting conditions and see if you find scenarios where you might not be able to get the solver to reach best fit values that agree with the one you started with. You will likely find that for certain combinations of simulated data, noise added, and specific starting conditions, you might not get estimates that are close to those you used to create the data. This suggests that even for this simple model with 3 parameters, estimating those 3 parameters based on the available data is not straightforward."	"T6R1"	"Estimate for parameter g after 200 iterations, solver 2"	"Numeric"	"Round to two significant digits, report as non-scientic notation (as X.YZ)"
"DSAIDE_fitflu"	"fitflu"	"Fitting Influenza data"	7	"Set everything back as in task 1 (so we'll use the real data again). Run solver 3 for 200 iterations, plot the results with the y-axis on a log scale. You will see that the initial data points are not well fit, later ones seem to be fit better. We are currently fitting the data on a linear scale. That means in the SSR equation, differences between large data and model values - which themselves tend to be larger in magnitude - often dominate. As an extreme example, if you have 2 data points you fit, one at 1E10 and the model predicts 1.1E10, that's a difference of 1E9. The second data point is 1E7, and the model predicts 1E6. This is in some sense a more significant discrepancy, but the difference is only 9E6, much smaller than the 1E9 for the first data point. What this means is that sometimes, it makes more sense to fit data on a log scale. Note that a switch of scales means a different scientific question/problem and the choice of scale should be driven by scientific considerations.
 
Let's take a look at this. Set everything as in task 1, run a single iteration with solver 3. The result should be familiar. Now set logfit to 1, repeat. The plot should look the same, but the SSR is now computed on the log of the data and the model and should be 40.72. What this means is that if we now run the optimizer, it tries to minimize a different equation (the SSR of the log of the data and model instead of the SSR of the data and model on the original scale). That means we should expect different results. Run solver 3 for 200 steps for logfit=0, then repeat for logfit=1. The final SSR obviously changes, but so does the best fit curve and the estimates for the parameter values.

You can explore all the tasks we went through above now with fitting the log of the data. While the general take-home messages are the same, the details will change. Again, fitting data on either a linear or log scale (or after doing some other transformation) can in the right circumstances all be reasonable approaches, the choice should be made based on the underlying biology/science. A good rule of thumb is that if the data spans several orders of magnitude, fitting on the log scale is probably the better option."	"T7R1"	"Estimate for parameter f after 200 iterations, solver 3, linear scale"	"Numeric"	"Round to two significant digits, report as non-scientic notation (as X.YZ)"
"DSAIDE_fitflu"	"fitflu"	"Fitting Influenza data"	7	"Set everything back as in task 1 (so we'll use the real data again). Run solver 3 for 200 iterations, plot the results with the y-axis on a log scale. You will see that the initial data points are not well fit, later ones seem to be fit better. We are currently fitting the data on a linear scale. That means in the SSR equation, differences between large data and model values - which themselves tend to be larger in magnitude - often dominate. As an extreme example, if you have 2 data points you fit, one at 1E10 and the model predicts 1.1E10, that's a difference of 1E9. The second data point is 1E7, and the model predicts 1E6. This is in some sense a more significant discrepancy, but the difference is only 9E6, much smaller than the 1E9 for the first data point. What this means is that sometimes, it makes more sense to fit data on a log scale. Note that a switch of scales means a different scientific question/problem and the choice of scale should be driven by scientific considerations.
 
Let's take a look at this. Set everything as in task 1, run a single iteration with solver 3. The result should be familiar. Now set logfit to 1, repeat. The plot should look the same, but the SSR is now computed on the log of the data and the model and should be 40.72. What this means is that if we now run the optimizer, it tries to minimize a different equation (the SSR of the log of the data and model instead of the SSR of the data and model on the original scale). That means we should expect different results. Run solver 3 for 200 steps for logfit=0, then repeat for logfit=1. The final SSR obviously changes, but so does the best fit curve and the estimates for the parameter values.

You can explore all the tasks we went through above now with fitting the log of the data. While the general take-home messages are the same, the details will change. Again, fitting data on either a linear or log scale (or after doing some other transformation) can in the right circumstances all be reasonable approaches, the choice should be made based on the underlying biology/science. A good rule of thumb is that if the data spans several orders of magnitude, fitting on the log scale is probably the better option."	"T7R1"	"Estimate for parameter f after 200 iterations, solver 3, log scale"	"Numeric"	"Round to two significant digits, report as non-scientic notation (as X.YZ)"
